{
  "capabilities": [
    "CREATIVE_PRODUCTION",
    "MEDIA_PIPELINES",
    "PUBLICATION_WORKFLOWS",
    "RIGHTS_LINEAGE"
  ],
  "contract_status": "PROPOSED",
  "domain_ref": "OGX_STUDIOS",
  "effect_classes": [
    "E0_NO_EXTERNAL_EFFECT"
  ],
  "evidence_refs": [
    "DudeStunna1/OGX-PRIME@ea9ffee73a11f9f5e260e6cd7c3f852b26488bb4:.MISSIONS-ADMINISTRATION/contracts/ogx-fleet-infrastructure-roadmap-r0.yaml",
    "DudeStunna1/OGX-PRIME@ea9ffee73a11f9f5e260e6cd7c3f852b26488bb4:.MISSIONS-ADMINISTRATION/contracts/ogx-global-horizon-public-surface-topology-r0.yaml",
    "DudeStunna1/ogx-studios@b7d35b7185bfafbf3f6027c8409d2fa8ffa8aab5:README.md"
  ],
  "fqdn": "studios.ogxglobalhorizon.com",
  "interfaces": [
    "OGX_PRIME_GOVERNED_CONTRACT",
    "SYSTEM_FOUNDRY_R2_PROPOSAL"
  ],
  "repository": "DudeStunna1/ogx-studios",
  "runtime_profiles": [
    "REPOSITORY_BLUEPRINT"
  ],
  "system_ref": "STUDIOS.OS"
}
