{
  "capabilities": [
    "JURISDICTION_MODELING",
    "PROVIDER_RELATIONSHIP_MODELING",
    "REGION_MODELING"
  ],
  "contract_status": "PROPOSED",
  "domain_ref": "OGX_GLOBAL",
  "effect_classes": [
    "E0_NO_EXTERNAL_EFFECT"
  ],
  "evidence_refs": [
    "DudeStunna1/OGX-PRIME@ea9ffee73a11f9f5e260e6cd7c3f852b26488bb4:.MISSIONS-ADMINISTRATION/contracts/ogx-fleet-infrastructure-roadmap-r0.yaml",
    "DudeStunna1/OGX-PRIME@ea9ffee73a11f9f5e260e6cd7c3f852b26488bb4:.MISSIONS-ADMINISTRATION/contracts/ogx-global-horizon-public-surface-topology-r0.yaml",
    "DudeStunna1/ogx-global@220e5cd9c9d04e206749b1a476f8d8a4e05c337f:README.md"
  ],
  "fqdn": "global.ogxglobalhorizon.com",
  "interfaces": [
    "OGX_PRIME_GOVERNED_CONTRACT",
    "SYSTEM_FOUNDRY_R2_PROPOSAL"
  ],
  "repository": "DudeStunna1/ogx-global",
  "runtime_profiles": [
    "REPOSITORY_BLUEPRINT"
  ],
  "system_ref": "GLOBAL.OS"
}
