{
  "capabilities": [
    "FEDERATION_DIRECTORY",
    "FEDERATION_PROJECTION",
    "PUBLIC_DISCOVERY",
    "ROUTING_DISCOVERY"
  ],
  "contract_status": "PROPOSED",
  "domain_ref": "OGX_GLOBAL_HORIZON",
  "effect_classes": [
    "E0_NO_EXTERNAL_EFFECT"
  ],
  "evidence_refs": [
    "DudeStunna1/OGX-PRIME@ea9ffee73a11f9f5e260e6cd7c3f852b26488bb4:.MISSIONS-ADMINISTRATION/contracts/ogx-fleet-infrastructure-roadmap-r0.yaml",
    "DudeStunna1/OGX-PRIME@ea9ffee73a11f9f5e260e6cd7c3f852b26488bb4:.MISSIONS-ADMINISTRATION/contracts/ogx-global-horizon-public-surface-topology-r0.yaml",
    "DudeStunna1/ogxglobalhorizon@bea365952cade89f1ce0a174cfe5a81d0dc3b89e:README.md"
  ],
  "fqdn": "ogxglobalhorizon.com",
  "interfaces": [
    "OGX_PRIME_GOVERNED_CONTRACT",
    "SYSTEM_FOUNDRY_R2_PROPOSAL"
  ],
  "repository": "DudeStunna1/ogxglobalhorizon",
  "runtime_profiles": [
    "REPOSITORY_BLUEPRINT"
  ],
  "system_ref": "HORIZON.OS"
}
